{
  "tenant": "_template",
  "mode": "fullpage",
  "brand": {
    "name": "AI Assistant",
    "favicon": "/skins/_template/assets/favicon.ico",
    "logo": "/skins/_template/assets/logo.svg",
    "primary": "#6c3bcc"
  },
  "directLine": {},
  "webchat": {
    "styleOptions": "/skins/_template/webchat/styleOptions.json",
    "adaptiveCardsHostConfig": "/skins/_template/webchat/hostconfig.json",
    "locale": "en-US"
  },
  "statusBar": {
    "show": true,
    "brand": {
      "ok": "#22c55e",
      "warn": "#f59e0b",
      "err": "#ef4444"
    }
  },
  "fullpage": {
    "index": "/skins/_template/fullpage/index.html",
    "css": "/skins/_template/fullpage/page.css"
  },
  "hooks": {
    "script": "/skins/_template/webchat/hooks.js"
  }
}
