{
  "tenant": "demo",
  "mode": "fullpage",
  "brand": {
    "name": "Demo Tenant",
    "favicon": "/skins/demo/assets/favicon.ico",
    "logo": "/skins/demo/assets/logo.svg",
    "primary": "#0F62FE"
  },
  "directLine": {
  },
  "webchat": {
    "styleOptions": "/skins/_template/webchat/styleOptions.json",
    "adaptiveCardsHostConfig": "/skins/_template/webchat/hostconfig.json",
    "locale": "en-US"
  },
  "statusBar": {
    "show": true,
    "brand": {
      "ok": "#22c55e",
      "warn": "#f59e0b",
      "err": "#ef4444"
    }
  },
  "fullpage": {
    "index": "/skins/_template/fullpage/index.html",
    "css": "/skins/_template/fullpage/page.css"
  },
  "hooks": {
    "script": "/skins/_template/webchat/hooks.js"
  }
}
